{"actuator_scope_mask":0,"axes":{"base":{"limits":"OUT_OF_SCOPE","motor_port":"outA","motor_type":"ev3-large"},"elbow":{"flexion_max_deg":90,"limits":"OUT_OF_SCOPE","motor_port":"outC","motor_type":"ev3-large"},"gripper":{"limits":"OUT_OF_SCOPE","motor_port":"outD","motor_type":"ev3-medium"},"shoulder":{"flexion_max_deg":90,"limits":"OUT_OF_SCOPE","motor_port":"outB","motor_type":"ev3-large"}},"build_profile":"Diagnostic","gripper_home":{"debounce_ms":null,"required":false,"sensor_port":"in3"},"local_stop":{"required":false,"sensor_port":"in4"},"logging":{"flight_recorder_rate_hz":50,"flight_recorder_seconds":10,"release_max_mb":250,"release_retention_days":7},"network":{"command_timeout_ms":120,"discovery_domain":"local.","discovery_service_type":"_phantom-ev3._udp","hello_retry_window_ms":2000,"ip_family":"IPV4","listen_port_udp":30470,"max_concurrent_control_sessions":1,"max_packet_bytes":1024,"max_payload_bytes":928,"rx_burst_packets":20,"rx_rate_limit_pps":100,"session_stale_ms":5000},"qualification_evidence_manifest_hash":"0000000000000000000000000000000000000000000000000000000000000000","qualification_only":true,"robot_id":"phantom01","safety":{"controller_heartbeat_rate_hz":20,"controller_heartbeat_timeout_ms":100,"external_power_cut_required":false,"loop_fault_ms":100,"loop_safe_hold_ms":60,"measured_limits_complete":false,"motor_output_default":"BRAKE_ZERO","ready_gate":"NETWORK_ONLY_NO_ACTUATOR_AUTHORITY"},"safety_observation_mask":0,"schema_version":1}
